{
  "schemaVersion": "1.0.0",
  "trackId": "robo_trance",
  "bpm": 129.2,
  "offsetSec": 0.2206,
  "seed": 20276060,
  "sections": [
    {
      "type": "Rest",
      "startSec": 0.2206,
      "endSec": 2.0782
    },
    {
      "type": "Active",
      "startSec": 2.0782,
      "endSec": 3.9358
    },
    {
      "type": "Rest",
      "startSec": 3.9358,
      "endSec": 13.2237
    },
    {
      "type": "Active",
      "startSec": 13.2237,
      "endSec": 15.0813
    },
    {
      "type": "Rest",
      "startSec": 15.0813,
      "endSec": 16.9389
    },
    {
      "type": "Active",
      "startSec": 16.9389,
      "endSec": 28.0844
    },
    {
      "type": "Rest",
      "startSec": 28.0844,
      "endSec": 29.942
    },
    {
      "type": "Active",
      "startSec": 29.942,
      "endSec": 33.6571
    },
    {
      "type": "Rest",
      "startSec": 33.6571,
      "endSec": 35.5147
    },
    {
      "type": "Active",
      "startSec": 35.5147,
      "endSec": 42.9451
    },
    {
      "type": "Rest",
      "startSec": 42.9451,
      "endSec": 44.8026
    },
    {
      "type": "Active",
      "startSec": 44.8026,
      "endSec": 50.3754
    },
    {
      "type": "Rest",
      "startSec": 50.3754,
      "endSec": 52.233
    },
    {
      "type": "Active",
      "startSec": 52.233,
      "endSec": 54.0906
    },
    {
      "type": "Rest",
      "startSec": 54.0906,
      "endSec": 55.9482
    },
    {
      "type": "Active",
      "startSec": 55.9482,
      "endSec": 65.2361
    },
    {
      "type": "Rest",
      "startSec": 65.2361,
      "endSec": 67.0937
    },
    {
      "type": "Active",
      "startSec": 67.0937,
      "endSec": 72.6664
    },
    {
      "type": "Rest",
      "startSec": 72.6664,
      "endSec": 76.3816
    },
    {
      "type": "Active",
      "startSec": 76.3816,
      "endSec": 78.2392
    },
    {
      "type": "Rest",
      "startSec": 78.2392,
      "endSec": 87.5271
    },
    {
      "type": "Active",
      "startSec": 87.5271,
      "endSec": 94.9574
    },
    {
      "type": "Rest",
      "startSec": 94.9574,
      "endSec": 96.815
    },
    {
      "type": "Active",
      "startSec": 96.815,
      "endSec": 102.3878
    },
    {
      "type": "Rest",
      "startSec": 102.3878,
      "endSec": 104.2454
    },
    {
      "type": "Active",
      "startSec": 104.2454,
      "endSec": 106.103
    },
    {
      "type": "Rest",
      "startSec": 106.103,
      "endSec": 107.9605
    },
    {
      "type": "Active",
      "startSec": 107.9605,
      "endSec": 115.3909
    },
    {
      "type": "Rest",
      "startSec": 115.3909,
      "endSec": 117.2485
    },
    {
      "type": "Active",
      "startSec": 117.2485,
      "endSec": 120.9636
    },
    {
      "type": "Rest",
      "startSec": 120.9636,
      "endSec": 122.8212
    },
    {
      "type": "Active",
      "startSec": 122.8212,
      "endSec": 130.2516
    },
    {
      "type": "Rest",
      "startSec": 130.2516,
      "endSec": 132.1091
    },
    {
      "type": "Active",
      "startSec": 132.1091,
      "endSec": 135.8243
    },
    {
      "type": "Rest",
      "startSec": 135.8243,
      "endSec": 137.6819
    },
    {
      "type": "Active",
      "startSec": 137.6819,
      "endSec": 146.9698
    },
    {
      "type": "Rest",
      "startSec": 146.9698,
      "endSec": 148.8274
    },
    {
      "type": "Active",
      "startSec": 148.8274,
      "endSec": 152.5426
    },
    {
      "type": "Rest",
      "startSec": 152.5426,
      "endSec": 155.0769
    }
  ],
  "tapEvents": [
    {
      "timeSec": 2.0782,
      "beatIndex": 4,
      "lane": 1,
      "prefabId": "tap_basic",
      "intensityTag": "mid"
    },
    {
      "timeSec": 13.2237,
      "beatIndex": 28,
      "lane": 1,
      "prefabId": "tap_basic",
      "intensityTag": "high"
    },
    {
      "timeSec": 16.9389,
      "beatIndex": 36,
      "lane": 1,
      "prefabId": "tap_basic",
      "intensityTag": "mid"
    },
    {
      "timeSec": 17.4033,
      "beatIndex": 37,
      "lane": 1,
      "prefabId": "tap_basic",
      "intensityTag": "mid"
    },
    {
      "timeSec": 17.8677,
      "beatIndex": 38,
      "lane": 1,
      "prefabId": "tap_basic",
      "intensityTag": "mid"
    },
    {
      "timeSec": 18.7965,
      "beatIndex": 40,
      "lane": 1,
      "prefabId": "tap_basic",
      "intensityTag": "mid"
    },
    {
      "timeSec": 20.654,
      "beatIndex": 44,
      "lane": 1,
      "prefabId": "tap_basic",
      "intensityTag": "mid"
    },
    {
      "timeSec": 21.1184,
      "beatIndex": 45,
      "lane": 1,
      "prefabId": "tap_basic",
      "intensityTag": "mid"
    },
    {
      "timeSec": 21.5828,
      "beatIndex": 46,
      "lane": 1,
      "prefabId": "tap_basic",
      "intensityTag": "mid"
    },
    {
      "timeSec": 22.5116,
      "beatIndex": 48,
      "lane": 1,
      "prefabId": "tap_basic",
      "intensityTag": "mid"
    },
    {
      "timeSec": 24.3692,
      "beatIndex": 52,
      "lane": 2,
      "prefabId": "tap_basic",
      "intensityTag": "mid"
    },
    {
      "timeSec": 24.8336,
      "beatIndex": 53,
      "lane": 0,
      "prefabId": "tap_basic",
      "intensityTag": "mid"
    },
    {
      "timeSec": 25.298,
      "beatIndex": 54,
      "lane": 1,
      "prefabId": "tap_basic",
      "intensityTag": "mid"
    },
    {
      "timeSec": 26.2268,
      "beatIndex": 56,
      "lane": 2,
      "prefabId": "tap_basic",
      "intensityTag": "mid"
    },
    {
      "timeSec": 26.6912,
      "beatIndex": 57,
      "lane": 0,
      "prefabId": "tap_basic",
      "intensityTag": "mid"
    },
    {
      "timeSec": 27.1556,
      "beatIndex": 58,
      "lane": 1,
      "prefabId": "tap_basic",
      "intensityTag": "mid"
    },
    {
      "timeSec": 29.942,
      "beatIndex": 64,
      "lane": 1,
      "prefabId": "tap_basic",
      "intensityTag": "mid"
    },
    {
      "timeSec": 31.7995,
      "beatIndex": 68,
      "lane": 1,
      "prefabId": "tap_basic",
      "intensityTag": "mid"
    },
    {
      "timeSec": 33.0766,
      "beatIndex": 71,
      "lane": 2,
      "prefabId": "tap_basic",
      "intensityTag": "mid"
    },
    {
      "timeSec": 35.5147,
      "beatIndex": 76,
      "lane": 0,
      "prefabId": "tap_basic",
      "intensityTag": "mid"
    },
    {
      "timeSec": 35.9791,
      "beatIndex": 77,
      "lane": 1,
      "prefabId": "tap_basic",
      "intensityTag": "mid"
    },
    {
      "timeSec": 36.4435,
      "beatIndex": 78,
      "lane": 2,
      "prefabId": "tap_basic",
      "intensityTag": "mid"
    },
    {
      "timeSec": 37.3723,
      "beatIndex": 80,
      "lane": 2,
      "prefabId": "tap_basic",
      "intensityTag": "mid"
    },
    {
      "timeSec": 38.6494,
      "beatIndex": 83,
      "lane": 0,
      "prefabId": "tap_basic",
      "intensityTag": "mid"
    },
    {
      "timeSec": 39.2299,
      "beatIndex": 84,
      "lane": 0,
      "prefabId": "tap_basic",
      "intensityTag": "mid"
    },
    {
      "timeSec": 40.507,
      "beatIndex": 87,
      "lane": 1,
      "prefabId": "tap_basic",
      "intensityTag": "mid"
    },
    {
      "timeSec": 41.0875,
      "beatIndex": 88,
      "lane": 1,
      "prefabId": "tap_basic",
      "intensityTag": "mid"
    },
    {
      "timeSec": 44.8026,
      "beatIndex": 96,
      "lane": 1,
      "prefabId": "tap_basic",
      "intensityTag": "mid"
    },
    {
      "timeSec": 46.0797,
      "beatIndex": 99,
      "lane": 2,
      "prefabId": "tap_basic",
      "intensityTag": "mid"
    },
    {
      "timeSec": 46.6602,
      "beatIndex": 100,
      "lane": 2,
      "prefabId": "tap_basic",
      "intensityTag": "mid"
    },
    {
      "timeSec": 48.5178,
      "beatIndex": 104,
      "lane": 2,
      "prefabId": "tap_basic",
      "intensityTag": "mid"
    },
    {
      "timeSec": 49.2144,
      "beatIndex": 106,
      "lane": 2,
      "prefabId": "tap_basic",
      "intensityTag": "mid"
    },
    {
      "timeSec": 49.6788,
      "beatIndex": 106,
      "lane": 2,
      "prefabId": "tap_basic",
      "intensityTag": "mid"
    },
    {
      "timeSec": 52.233,
      "beatIndex": 112,
      "lane": 0,
      "prefabId": "tap_basic",
      "intensityTag": "mid"
    },
    {
      "timeSec": 52.6974,
      "beatIndex": 113,
      "lane": 1,
      "prefabId": "tap_basic",
      "intensityTag": "mid"
    },
    {
      "timeSec": 53.1618,
      "beatIndex": 114,
      "lane": 2,
      "prefabId": "tap_basic",
      "intensityTag": "mid"
    },
    {
      "timeSec": 55.9482,
      "beatIndex": 120,
      "lane": 2,
      "prefabId": "tap_basic",
      "intensityTag": "mid"
    },
    {
      "timeSec": 56.6447,
      "beatIndex": 122,
      "lane": 1,
      "prefabId": "tap_basic",
      "intensityTag": "mid"
    },
    {
      "timeSec": 57.1091,
      "beatIndex": 122,
      "lane": 0,
      "prefabId": "tap_basic",
      "intensityTag": "mid"
    },
    {
      "timeSec": 57.8057,
      "beatIndex": 124,
      "lane": 0,
      "prefabId": "tap_basic",
      "intensityTag": "mid"
    },
    {
      "timeSec": 59.6633,
      "beatIndex": 128,
      "lane": 1,
      "prefabId": "tap_basic",
      "intensityTag": "mid"
    },
    {
      "timeSec": 60.1277,
      "beatIndex": 129,
      "lane": 2,
      "prefabId": "tap_basic",
      "intensityTag": "mid"
    },
    {
      "timeSec": 60.5921,
      "beatIndex": 130,
      "lane": 0,
      "prefabId": "tap_basic",
      "intensityTag": "mid"
    },
    {
      "timeSec": 61.5209,
      "beatIndex": 132,
      "lane": 0,
      "prefabId": "tap_basic",
      "intensityTag": "mid"
    },
    {
      "timeSec": 63.3785,
      "beatIndex": 136,
      "lane": 0,
      "prefabId": "tap_basic",
      "intensityTag": "mid"
    },
    {
      "timeSec": 63.8429,
      "beatIndex": 137,
      "lane": 0,
      "prefabId": "tap_basic",
      "intensityTag": "mid"
    },
    {
      "timeSec": 64.3073,
      "beatIndex": 138,
      "lane": 0,